{
  "p": "dmp",
  "v": "2",
  "op": "cancel",
  "list_id": "0d0a3b12da68b4d241b693fe8325c5a34d4106adbddf90c429ddba16f28f3dafi0",
  "asigs": [
    "IGAy/QqVrSHrjjQ2RRkM3+hsz54kKZ+X02Qs/luZIZ2gSA1N6JAtn23xMXzxaXDqugCwAJGkncIQcS2fvztVPaw=",
    "H217lUEowZtDFJx5qoSRJ9AWMF4G1ZqpnD0qG1ttuhSyShEi4NHxoCbEpy1F/dUEU4CJ3km2ZTOZjEXpEXpTqdA="
  ]
}
